start	end	text
0	8560	Seguimos en mesa técnica. Seugracias por tu análisis. Las situaciones siguientes hoy necesito tener
8560	15120	ser rado las 42 fichas más el documento consolidado. sobre esto necesito que active los
15120	20920	agentes vidas que sean ese salio de tal forma que podemos dar cumplimiento de debemos complementar
20920	27040	los 42 fichas que faltan. Segundo aplicar una gente de calidad que verificé que lo
27040	33640	es un link este en correcto. Terceros desharezones repositorios sugiero crear una carpeta
33640	39280	con nombre diferente para verificar lo que estás haciendo. Cuarto tu desactor como un
39280	44280	orquestador del trabajo. Tienes que crear los agentes de negociaciones de salio. Te desarrollo
44280	48320	un pleno de trabajo. Esto es extremo que trae al día de hoy sin creenizar tu horario con
48320	52600	o la idea de colombia de estar muy ubicado actualmente. ¿Presenta pleno de trabajo para revisar?
